status,title,doi,authors,year,code,website,keywords,selected
publish,LatentAugment: Data Augmentation via Guided Manipulation of GAN's Latent Space,10.1109/TPAMI.2025.3598866,"Lorenzo Tronchin; Minh H. Vu; Paolo Soda; Tommy Lofstedt",2025,https://github.com/ltronchin/LatentAugment,,"data augmentation; generative models; representation learning",TRUE
publish,A systematic review of intermediate fusion in multimodal deep learning for biomedical applications,10.1016/j.imavis.2025.105509,"Valerio Guarrasi; Fatih Aksu; Camillo Maria Caruso; Francesco Di Feola; Aurora Rofena; Filippo Ruffini; Paolo Soda",2025,https://github.com/cosbidev/Intermediate-Multimodal-Fusion-Bio,,"multimodal learning; biomedical AI; survey",TRUE
publish,Multimodal explainability via latent shift applied to COVID-19 stratification,10.1016/j.patcog.2024.110825,"Valerio Guarrasi; Lorenzo Tronchin; Domenico Albano; Eliodoro Faiella; Deborah Fazzini; Domiziana Santucci; Paolo Soda",2024,,,"explainability; multimodal learning; COVID-19",TRUE
publish,A deep learning approach for overall survival prediction in lung cancer with missing values,10.1016/j.cmpb.2024.108308,"Camillo Maria Caruso; Valerio Guarrasi; Sara Ramella; Paolo Soda",2024,,,"survival analysis; oncology; clinical prediction",FALSE
publish,A graph neural network-based model with out-of-distribution robustness for enhancing antiretroviral therapy outcome prediction for HIV-1,10.1016/j.compmedimag.2024.102484,"Giulia Di Teodoro; Federico Siciliano; Valerio Guarrasi; Anne-Mieke Vandamme; Valeria Ghisetti; Anders Sonnerborg; Maurizio Zazzi; Fabrizio Silvestri; Laura Palagi",2025,https://github.com/federicosiciliano/graph-ood-hiv,,"graph neural networks; HIV; robustness",FALSE
publish,An optimized ensemble search approach for classification of higher-level gait disorder using brain magnetic resonance images,10.1016/j.compbiomed.2024.109457,"Klara Mogensen; Valerio Guarrasi; Jenny Larsson; William Hansson; Anders Wahlin; Lars-Owe Koskinen; Jan Malm; Anders Eklund; Paolo Soda; Sara Qvarlander",2025,,,"brain MRI; gait disorder; medical imaging",FALSE
publish,XGeM: A multi-prompt foundation model for multimodal medical data generation,10.1016/j.compmedimag.2026.102718,"Daniele Molino; Francesco Di Feola; Eliodoro Faiella; Deborah Fazzini; Domiziana Santucci; Linlin Shen; Valerio Guarrasi; Paolo Soda",2026,https://github.com/cosbidev/XGeM,https://xgem.ucbm.org/overview,"foundation models; multimodal generation; medical AI",TRUE
publish,Probabilistic NDVI Forecasting from Sparse Satellite Time Series and Weather Covariates,10.48550/arXiv.2602.17683,"Irene Iele; Giulia Romoli; Daniele Molino; Elena Mulero Ayllón; Filippo Ruffini; Paolo Soda; Matteo Tortora",2026,https://github.com/arco-group/ndvi-forecasting,,"remote sensing; time series forecasting; probabilistic modelling",FALSE
