status,title,doi,authors,year,code,website,keywords,selected
publish,LatentAugment: Data Augmentation via Guided Manipulation of GAN's Latent Space,10.1109/TPAMI.2025.3598866,"Lorenzo Tronchin; Minh H. Vu; Paolo Soda; Tommy Lofstedt",2025,https://github.com/ltronchin/LatentAugment,,"data augmentation; generative models; representation learning",TRUE
publish,A systematic review of intermediate fusion in multimodal deep learning for biomedical applications,10.1016/j.imavis.2025.105509,"Valerio Guarrasi; Fatih Aksu; Camillo Maria Caruso; Francesco Di Feola; Aurora Rofena; Filippo Ruffini; Paolo Soda",2025,https://github.com/cosbidev/Intermediate-Multimodal-Fusion-Bio,,"multimodal learning; biomedical AI; survey",TRUE
publish,Multimodal explainability via latent shift applied to COVID-19 stratification,10.1016/j.patcog.2024.110825,"Valerio Guarrasi; Lorenzo Tronchin; Domenico Albano; Eliodoro Faiella; Deborah Fazzini; Domiziana Santucci; Paolo Soda",2024,,,"explainability; multimodal learning; COVID-19",TRUE
publish,A deep learning approach for overall survival prediction in lung cancer with missing values,10.1016/j.cmpb.2024.108308,"Camillo Maria Caruso; Valerio Guarrasi; Sara Ramella; Paolo Soda",2024,,,"survival analysis; oncology; clinical prediction",FALSE
publish,A graph neural network-based model with out-of-distribution robustness for enhancing antiretroviral therapy outcome prediction for HIV-1,10.1016/j.compmedimag.2024.102484,"Giulia Di Teodoro; Federico Siciliano; Valerio Guarrasi; Anne-Mieke Vandamme; Valeria Ghisetti; Anders Sonnerborg; Maurizio Zazzi; Fabrizio Silvestri; Laura Palagi",2025,https://github.com/federicosiciliano/graph-ood-hiv,,"graph neural networks; HIV; robustness",FALSE
publish,An optimized ensemble search approach for classification of higher-level gait disorder using brain magnetic resonance images,10.1016/j.compbiomed.2024.109457,"Klara Mogensen; Valerio Guarrasi; Jenny Larsson; William Hansson; Anders Wahlin; Lars-Owe Koskinen; Jan Malm; Anders Eklund; Paolo Soda; Sara Qvarlander",2025,,,"brain MRI; gait disorder; medical imaging",FALSE
publish,XGeM: A multi-prompt foundation model for multimodal medical data generation,10.1016/j.compmedimag.2026.102718,"Daniele Molino; Francesco Di Feola; Eliodoro Faiella; Deborah Fazzini; Domiziana Santucci; Linlin Shen; Valerio Guarrasi; Paolo Soda",2026,https://github.com/cosbidev/XGeM,https://xgem.ucbm.org/overview,"foundation models; multimodal generation; medical AI",TRUE
publish,Probabilistic NDVI Forecasting from Sparse Satellite Time Series and Weather Covariates,10.48550/arXiv.2602.17683,"Irene Iele; Giulia Romoli; Daniele Molino; Elena Mulero Ayllón; Filippo Ruffini; Paolo Soda; Matteo Tortora",2026,https://github.com/arco-group/ndvi-forecasting,,"remote sensing; time series forecasting; probabilistic modelling",FALSE
publish,Class balancing diversity multimodal ensemble for Alzheimer's disease diagnosis and early detection,10.1016/j.compmedimag.2025.102529,"Arianna Francesconi; Lazzaro di Biase; Donato Cappetta; Fabio Rebecchi; Paolo Soda; Rosa Sicilia; Valerio Guarrasi",2025,,,"Alzheimer's disease; multimodal learning; ensemble methods",FALSE
publish,"Doctor-in-the-Loop: An explainable, multi-view deep learning framework for predicting pathological response in non-small cell lung cancer",10.1016/j.imavis.2025.105630,"Alice Natalina Caragliano; Filippo Ruffini; Carlo Greco; Edy Ippolito; Michele Fiore; Claudia Tacconi; Lorenzo Nibid; Giuseppe Perrone; Sara Ramella; Paolo Soda; Valerio Guarrasi",2025,,,"explainability; oncology; medical imaging",TRUE
publish,Augmented intelligence for multimodal virtual biopsy in breast cancer using generative artificial intelligence,10.1016/j.jbi.2025.104971,"Aurora Rofena; Claudia Lucia Piccolo; Bruno Beomonte Zobel; Paolo Soda; Valerio Guarrasi",2026,,,"breast cancer; multimodal learning; generative AI",TRUE
publish,"Multi-objective optimization determines when, which and how to fuse deep networks: An application to predict COVID-19 outcomes",10.1016/j.compbiomed.2023.106625,"Valerio Guarrasi; Paolo Soda",2023,,,"COVID-19; multimodal learning; optimization",TRUE
publish,AIforCOVID: Predicting the clinical outcomes in patients with COVID-19 applying AI to chest-X-rays. An Italian multicentre study,10.1016/j.media.2021.102216,"Paolo Soda; Natascha Claudia D'Amico; Jacopo Tessadori; Giovanni Valbusa; Valerio Guarrasi; Chandra Bortolotto; Muhammad Usman Akbar; Rosa Sicilia; Ermanno Cordelli; Deborah Fazzini; Michaela Cellina; Giancarlo Oliva; Giovanni Callea; Silvia Panella; Maurizio Cariati; Diletta Cozzi; Vittorio Miele; Elvira Stellato; Gianpaolo Carrafiello; Giulia Castorani; Annalisa Simeone; Lorenzo Preda; Giulio Iannello; Alessio Del Bue; Fabio Tedoldi; Marco Alí; Diego Sona; Sergio Papa",2021,,,"COVID-19; chest X-ray; clinical prediction",FALSE
publish,MARIA: A multimodal transformer model for incomplete healthcare data,10.1016/j.compbiomed.2025.110843,"Camillo Maria Caruso; Paolo Soda; Valerio Guarrasi",2025,https://github.com/cosbidev/MARIA,,"multimodal learning; transformers; missing data",TRUE
publish,Beyond unimodal analysis: Multimodal ensemble learning for enhanced assessment of atherosclerotic disease progression,10.1016/j.compmedimag.2025.102617,"Valerio Guarrasi; Amanda Bertgren; Ulf Näslund; Patrik Wennberg; Paolo Soda; Christer Grönlund",2025,,,"multimodal learning; cardiovascular risk; ensemble methods",FALSE
publish,Pareto optimization of deep networks for COVID-19 diagnosis from chest X-rays,10.1016/j.patcog.2021.108242,"Valerio Guarrasi; Natascha Claudia D'Amico; Rosa Sicilia; Ermanno Cordelli; Paolo Soda",2022,,,"COVID-19; chest X-ray; optimization",FALSE
publish,Radiomics for Predicting Prognostic Factors in Breast Cancer: Insights from Contrast-Enhanced Mammography (CEM),10.3390/jcm13216486,"Claudia Lucia Piccolo; Marina Sarli; Matteo Pileri; Manuela Tommasiello; Aurora Rofena; Valerio Guarrasi; Paolo Soda; Bruno Beomonte Zobel",2024,,,"breast cancer; radiomics; mammography",FALSE
publish,Whole-Body Image-to-Image Translation for a Virtual Scanner in a Healthcare Digital Twin,10.1109/CBMS65348.2025.00114,"Valerio Guarrasi; Francesco Di Feola; Rebecca Restivo; Lorenzo Tronchin; Paolo Soda",2025,,,"digital twins; medical imaging; image translation",FALSE
publish,Timing Is Everything: Finding the Optimal Fusion Points in Multimodal Medical Imaging,10.1109/IJCNN64981.2025.11227201,"Valerio Guarrasi; Klara Mogensen; Sara Tassinari; Sara Qvarlander; Paolo Soda",2025,,,"multimodal learning; medical imaging; fusion",FALSE
publish,Beyond a single mode: GAN ensembles for diverse medical data generation,10.1016/j.cmpb.2026.109234,"Lorenzo Tronchin; Tommy Löfstedt; Paolo Soda; Valerio Guarrasi",2026,https://github.com/ltronchin/GAN-Ensembles,,"generative AI; GANs; medical imaging",TRUE
publish,Any-to-Any Vision-Language Model for Multimodal X-ray Imaging and Radiological Report Generation,10.1109/IJCNN64981.2025.11227399,"Daniele Molino; Francesco Di Feola; Linlin Shen; Paolo Soda; Valerio Guarrasi",2025,,,"vision-language models; radiology; multimodal generation",FALSE
publish,Evaluating Vision Language Model Adaptations for Radiology Report Generation in Low-Resource Languages,10.1109/IJCNN64981.2025.11227552,"Marco Salmè; Rosa Sicilia; Paolo Soda; Valerio Guarrasi",2025,,,"vision-language models; radiology; low-resource languages",FALSE
publish,Can Foundation Models Really Segment Tumors? A Benchmarking Odyssey in Lung CT Imaging,10.48550/arXiv.2505.01239,"Elena Mulero Ayllón; Massimiliano Mantegna; Linlin Shen; Paolo Soda; Valerio Guarrasi; Matteo Tortora",2025,,,"foundation models; lung CT; segmentation",FALSE
publish,Emerging Microorganisms and Infectious Diseases: One Health Approach for Health Shared Vision,10.3390/genes15070908,"Maria Vittoria Ristori; Valerio Guarrasi; Paolo Soda; Nicola Petrosillo; Fiorella Gurrieri; Umile Giuseppe Longo; Massimo Ciccozzi; Elisabetta Riva; Silvia Angeletti",2024,,,"one health; infectious diseases; biomedical AI",FALSE
publish,A deep learning approach for virtual contrast enhancement in Contrast Enhanced Spectral Mammography,10.1016/j.compmedimag.2024.102398,"Aurora Rofena; Valerio Guarrasi; Marina Sarli; Claudia Lucia Piccolo; Matteo Sammarra; Bruno Beomonte Zobel; Paolo Soda",2024,,,"breast imaging; mammography; generative AI",TRUE
publish,Machine Learning for Predicting the Low Risk of Postoperative Pancreatic Fistula After Pancreaticoduodenectomy: Toward a Dynamic and Personalized Postoperative Management Strategy,10.3390/cancers17111846,"Roberto Cammarata; Filippo Ruffini; Alberto Catamerò; Gennaro Melone; Gianluca Costa; Silvia Angeletti; Federico Seghetti; Vincenzo La Vaccara; Roberto Coppola; Paolo Soda; Valerio Guarrasi; Damiano Caputo",2025,,,"clinical prediction; surgery; risk stratification",FALSE
publish,Not another imputation method: A transformer-based model for missing values in tabular datasets,10.1016/j.aiopen.2026.02.005,"Camillo Maria Caruso; Paolo Soda; Valerio Guarrasi",2026,https://github.com/cosbidev/NAIM,,"missing data; transformers; tabular learning",TRUE
publish,Benchmarking foundation models and parameter-efficient fine-tuning for prognosis prediction in medical imaging,10.1016/j.cmpb.2025.109196,"Filippo Ruffini; Elena Mulero Ayllón; Linlin Shen; Paolo Soda; Valerio Guarrasi",2026,,,"foundation models; prognosis prediction; medical imaging",FALSE
publish,Robust radiomics: a review of guidelines for radiomics in medical imaging,10.3389/fradi.2025.1701110,"Michele Avanzo; Paolo Soda; Marco Bertolini; Andrea Bettinelli; Tiziana Rancati; Joseph Stancanello; Osvaldo Rampado; Giovanni Pirrone; Annalisa Drigo",2026,,,"radiomics; review; medical imaging",FALSE
publish,Text-to-CT Generation via 3D Latent Diffusion Model with Contrastive Vision-Language Pretraining,10.48550/arXiv.2506.00633,"Daniele Molino; Camillo Maria Caruso; Filippo Ruffini; Paolo Soda; Valerio Guarrasi",2025,,,"text-to-image generation; CT; diffusion models",FALSE
publish,Assessing the impact of data-driven limitations on tracing and forecasting the outbreak dynamics of COVID-19,10.1016/j.compbiomed.2021.104657,"Giulia Fiscon; Francesco Salvadore; Valerio Guarrasi; Paolo Soda",2021,,,"COVID-19; forecasting; epidemiology",FALSE
publish,A Multi-Expert System to Detect COVID-19 Cases in X-ray Images,10.1109/CBMS52027.2021.00090,"Valerio Guarrasi; Natascha Claudia D'Amico; Rosa Sicilia; Ermanno Cordelli; Paolo Soda",2021,,,"COVID-19; chest X-ray; ensemble methods",FALSE
publish,A Multimodal Ensemble Driven by Multiobjective Optimisation to Predict Overall Survival in Non-Small-Cell Lung Cancer,10.3390/jimaging8110298,"Camillo Maria Caruso; Valerio Guarrasi; Ermanno Cordelli; Rosa Sicilia; Silvia Gentile; Laura Messina; Michele Fiore; Claudia Piccolo; Bruno Beomonte Zobel; Giulio Iannello; Sara Ramella; Paolo Soda",2022,,,"multimodal learning; oncology; survival analysis",FALSE
publish,Machine learning predicts pulmonary Long Covid sequelae using clinical data,10.1186/s12911-024-02745-3,"Ermanno Cordelli; Paolo Soda; Sara Citter; Elia Schiavon; Christian Salvatore; Deborah Fazzini; Greta Clementi; Michaela Cellina; Andrea Cozzi; Chandra Bortolotto; Lorenzo Preda; Luisa Francini; Matteo Tortora; Isabella Castiglioni; Sergio Papa; Diego Sona; Marco Alì",2024,,,"long COVID; clinical prediction; machine learning",FALSE
publish,Multi-Dataset Multi-Task Learning for COVID-19 Prognosis,10.1007/978-3-031-72390-2_24,"Filippo Ruffini; Lorenzo Tronchin; Zhuoru Wu; Wenting Chen; Paolo Soda; Linlin Shen; Valerio Guarrasi",2024,https://github.com/cosbidev/Multi-Dataset-Multi-Task-Learning-for-COVID-19-Prognosis,,"COVID-19; prognosis prediction; multitask learning",TRUE
publish,Multi-scale texture loss for CT denoising with GANs,10.48550/arXiv.2403.16640,"Francesco Di Feola; Lorenzo Tronchin; Valerio Guarrasi; Paolo Soda",2025,https://github.com/FrancescoDiFeola/DenoTextureLoss,,"CT denoising; GANs; texture analysis",FALSE
publish,Texture-Aware StarGAN for CT data harmonization,10.48550/arXiv.2503.15058,"Francesco Di Feola; Ludovica Pompilio; Cecilia Assolito; Valerio Guarrasi; Paolo Soda",2025,,,"CT harmonization; GANs; medical imaging",FALSE
publish,Sample-Aware Test-Time Adaptation for Medical Image-to-Image Translation,10.48550/arXiv.2508.00766,"Irene Iele; Francesco Di Feola; Valerio Guarrasi; Paolo Soda",2025,https://github.com/Sample-Aware-TTA/Code,,"test-time adaptation; image-to-image translation; medical imaging",FALSE
publish,Virtual Scanner: Leveraging Resilient Generative AI for Radiological Imaging in the Era of Medical Digital Twins,,"Ermanno Cordelli; Valerio Guarrasi; Giulio Iannello; Aurora Rofena; Rosa Sicilia; Paolo Soda; Matteo Tortora; Lorenzo Tronchin",2024,,https://www.iris.unicampus.it/handle/20.500.12610/88590,"digital twins; radiology; generative AI",FALSE
publish,Building an AI-Enabled Metaverse for Intelligent Healthcare: Opportunities and Challenges,,"Valerio Guarrasi; Lorenzo Tronchin; Camillo Maria Caruso; Aurora Rofena; Guido Manni; Fatih Aksu; Domenico Paolo; Giulio Iannello; Rosa Sicilia; Ermanno Cordelli; Paolo Soda",2023,,https://ceur-ws.org/Vol-3486/74.pdf,"metaverse; intelligent healthcare; multimodal AI",FALSE
publish,Making AI trustworthy in multimodal and healthcare scenarios,,"Ermanno Cordelli; Valerio Guarrasi; Giulio Iannello; Rosa Sicilia; Paolo Soda; Lorenzo Tronchin",2023,,https://www.iris.unicampus.it/handle/20.500.12610/79227,"explainable AI; trustworthy AI; multimodal learning",FALSE
publish,Sustainable AI: inside the deep, alongside the green,,"Francesco Conte; Ermanno Cordelli; Valerio Guarrasi; Giulio Iannello; Rosa Sicilia; Paolo Soda; Matteo Tortora; Lorenzo Tronchin",2023,,https://ceur-ws.org/Vol-3486/78.pdf,"sustainable AI; green AI; responsible AI",FALSE
publish,Towards AI-driven Next Generation Personalized Healthcare and Well-being,,"Fatih Aksu; Alessandro Bria; Alice Natalina Caragliano; Camillo Maria Caruso; Wenting Chen; Ermanno Cordelli; Omar Coser; Arianna Francesconi; Leonardo Furia; Valerio Guarrasi; Giulio Iannello; Clemente Lauretti; Guido Manni; Giustino Marino; Domenico Paolo; Filippo Ruffini; Linlin Shen; Rosa Sicilia; Paolo Soda; Christian Tamantini; Matteo Tortora; Zhuoru Wu; Loredana Zollo",2024,,https://www.iris.unicampus.it/bitstream/20.500.12610/82624/2/20.500.12610-82624.pdf,"precision medicine; healthcare robotics; multimodal AI",FALSE
publish,Ecology and Machine Learning-Based Classification Models of Gut Microbiota and Inflammatory Markers May Evaluate the Effects of Probiotic Supplementation in Patients Recently Recovered from COVID-19,10.3390/ijms24076623,"Lucrezia Laterza; Lorenza Putignani; Carlo Romano Settanni; Valentina Petito; Simone Varca; Flavio De Maio; Gabriele Macari; Valerio Guarrasi; Elisa Gremese; Barbara Tolusso; Giulia Wlderk; Maria Antonia Pirro; Caterina Fanali; Franco Scaldaferri; Laura Turchini; Valeria Amatucci; Maurizio Sanguinetti; Antonio Gasbarrini",2023,,,"microbiota; COVID-19; machine learning",FALSE
publish,Optimized fusion of CNNs to diagnose pulmonary diseases on chest X-Rays,10.1007/978-3-031-06427-2_17,"Valerio Guarrasi; Paolo Soda",2022,,,"chest X-ray; CNNs; multimodal optimization",FALSE
publish,MedCoDi-M: A Multi-Prompt Foundation Model for Multimodal Medical Data Generation,10.48550/arXiv.2501.04614,"Daniele Molino; Francesco Di Feola; Eliodoro Faiella; Deborah Fazzini; Domiziana Santucci; Linlin Shen; Valerio Guarrasi; Paolo Soda",2025,,https://cosbidev.github.io/MedCoDi-M/,"foundation models; multimodal generation; radiology",FALSE
publish,Deep Reinforcement Learning for Fractionated Radiotherapy in Non-Small Cell Lung Carcinoma,10.1016/j.artmed.2021.102137,"Matteo Tortora; Ermanno Cordelli; Rosa Sicilia; Marianna Miele; Paolo Matteucci; Giulio Iannello; Sara Ramella; Paolo Soda",2021,,,"reinforcement learning; radiotherapy; lung cancer",FALSE
publish,Deep pathomics: A new image-based tool for predicting response to treatment in stage III non-small cell lung cancer,10.1371/journal.pone.0294259,"Lorenzo Nibid; Carlo Greco; Ermanno Cordelli; Giovanna Sabarese; Michele Fiore; Charles Z Liu; Edy Ippolito; Rosa Sicilia; Marianna Miele; Matteo Tortora; Chiara Taffon; Mehrdad Rakaee; Paolo Soda; Sara Ramella; Giuseppe Perrone",2023,,,"pathomics; lung cancer; treatment response",FALSE
publish,3T MRI-Radiomic Approach to Predict for Lymph Node Status in Breast Cancer Patients,10.3390/cancers13092228,"Domiziana Santucci; Eliodoro Faiella; Ermanno Cordelli; Rosa Sicilia; Carlo de Felice; Bruno Beomonte Zobel; Giulio Iannello; Paolo Soda",2021,,,"breast cancer; radiomics; MRI",FALSE
publish,CNN-Based Approaches with Different Tumor Bounding Options for Lymph Node Status Prediction in Breast DCE-MRI,10.3390/cancers14194574,"Domiziana Santucci; Eliodoro Faiella; Michela Gravina; Ermanno Cordelli; Carlo de Felice; Bruno Beomonte Zobel; Giulio Iannello; Carlo Sansone; Paolo Soda",2022,,,"breast cancer; MRI; deep learning",FALSE
publish,Quantib Prostate Compared to an Expert Radiologist for the Diagnosis of Prostate Cancer on mpMRI: A Single-Center Preliminary Study,10.3390/tomography8040168,"Eliodoro Faiella; Daniele Vertulli; Francesco Esperto; Ermanno Cordelli; Paolo Soda; Rosa Maria Muraca; Lorenzo Paolo Moramarco; Rosario Francesco Grasso; Bruno Beomonte Zobel; Domiziana Santucci",2022,,,"prostate cancer; MRI; computer-aided diagnosis",FALSE
publish,3T-MRI Artificial Intelligence in Patients with Invasive Breast Cancer to Predict Distant Metastasis Status: A Pilot Study,10.3390/cancers15010036,"Alessandro Calabrese; Domiziana Santucci; Michela Gravina; Eliodoro Faiella; Ermanno Cordelli; Paolo Soda; Giulio Iannello; Carlo Sansone; Bruno Beomonte Zobel; Carlo Catalano; Carlo de Felice",2023,,,"breast cancer; MRI; metastasis prediction",FALSE
publish,Time-Window SIQR Analysis of COVID-19 Outbreak and Containment Measures in Italy,10.1109/CBMS49503.2020.00059,"Ermanno Cordelli; Matteo Tortora; Rosa Sicilia; Paolo Soda",2020,,,"COVID-19; epidemic modelling; forecasting",FALSE
publish,On Using Meta-Features to Learn Under Class Skew in Biomedical Domains,,"Rosa Sicilia; Ermanno Cordelli; Paolo Soda",2020,,https://www.iris.unicampus.it/handle/20.500.12610/15488,"class imbalance; meta-learning; biomedical data",FALSE
publish,Predicting lung cancer survival with attention-based CT slices combination,10.1007/s13755-025-00404-z,"Domenico Paolo; Carlo Greco; Edy Ippolito; Michele Fiore; Sara Ramella; Paolo Soda; Matteo Tortora; Alessandro Bria; Rosa Sicilia",2026,,,"lung cancer; survival prediction; CT",FALSE
